"No.","Time","Source","Destination","Protocol","Length","Info"
"31","17.511753952","192.168.1.12","8.8.8.8","DNS","126","Standard query 0xd9bc A cdnjs.cloudflare.com"
"32","17.589672161","8.8.8.8","192.168.1.12","TCP","74","53  >  39958 [SYN, ACK] Seq=0 Ack=41 Win=65535 Len=0 MSS=1412 SACK_PERM TSval=75112912 TSecr=3933964935 WS=256"
"33","17.589672628","8.8.8.8","192.168.1.12","DNS","138","Standard query response 0xd9bc A cdnjs.cloudflare.com A 104.17.24.14 A 104.17.25.14"
"34","17.589789210","192.168.1.12","8.8.8.8","TCP","66","39958  >  53 [ACK] Seq=41 Ack=1 Win=32128 Len=0 TSval=3933965013 TSecr=75112912"
"35","17.589814705","192.168.1.12","8.8.8.8","TCP","66","39958  >  53 [ACK] Seq=41 Ack=73 Win=32128 Len=0 TSval=3933965013 TSecr=75112915"
"36","17.589923935","192.168.1.12","8.8.8.8","DNS","101","Standard query 0x068e A httpforever.com"
"37","17.590316845","192.168.1.12","8.8.8.8","DNS","101","Standard query 0x2a2e AAAA httpforever.com"
"38","17.590630150","192.168.1.12","104.17.24.14","TCP","74","55808  >  443 [SYN] Seq=0 Win=32120 Len=0 MSS=1460 SACK_PERM TSval=845082545 TSecr=0 WS=128"
"40","17.640377866","104.17.24.14","192.168.1.12","TCP","74","443  >  55808 [SYN, ACK] Seq=0 Ack=1 Win=65535 Len=0 MSS=1400 SACK_PERM TSval=4118661301 TSecr=845082545 WS=8192"
"41","17.640420610","192.168.1.12","104.17.24.14","TCP","66","55808  >  443 [ACK] Seq=1 Ack=1 Win=32128 Len=0 TSval=845082595 TSecr=4118661301"
"42","17.641487979","192.168.1.12","104.17.24.14","TLSv1.3","1229","Client Hello (SNI=cdnjs.cloudflare.com)"
"43","17.641651686","192.168.1.12","104.17.24.14","TLSv1.3","72","Change Cipher Spec"
"44","17.641672971","192.168.1.12","104.17.24.14","TLSv1.3","158","Application Data"
"45","17.660548792","8.8.8.8","192.168.1.12","TCP","66","53  >  39958 [ACK] Seq=73 Ack=76 Win=268800 Len=0 TSval=75112974 TSecr=3933965013"
"46","17.660549060","8.8.8.8","192.168.1.12","TCP","66","53  >  39958 [ACK] Seq=73 Ack=111 Win=268800 Len=0 TSval=75112975 TSecr=3933965014"
"47","17.660549113","8.8.8.8","192.168.1.12","DNS","117","Standard query response 0x068e A httpforever.com A 146.190.62.39"
"48","17.660549166","8.8.8.8","192.168.1.12","DNS","129","Standard query response 0x2a2e AAAA httpforever.com AAAA 2604:a880:4:1d0::1f1:2000"
"49","17.660953824","192.168.1.12","8.8.8.8","TCP","66","39958  >  53 [ACK] Seq=111 Ack=187 Win=32128 Len=0 TSval=3933965084 TSecr=75112979"
"50","17.662345256","192.168.1.12","146.190.62.39","TCP","74","57888  >  80 [SYN] Seq=0 Win=32120 Len=0 MSS=1460 SACK_PERM TSval=90926387 TSecr=0 WS=128"
"51","17.662395356","192.168.1.12","146.190.62.39","TCP","74","57902  >  80 [SYN] Seq=0 Win=32120 Len=0 MSS=1460 SACK_PERM TSval=90926387 TSecr=0 WS=128"
"53","17.701148866","104.17.24.14","192.168.1.12","TCP","66","443  >  55808 [ACK] Seq=1 Ack=1164 Win=73728 Len=0 TSval=4118661355 TSecr=845082596"
"54","17.701149055","104.17.24.14","192.168.1.12","TCP","66","443  >  55808 [ACK] Seq=1 Ack=1170 Win=73728 Len=0 TSval=4118661355 TSecr=845082596"
"55","17.701149097","104.17.24.14","192.168.1.12","TCP","66","443  >  55808 [ACK] Seq=1 Ack=1262 Win=73728 Len=0 TSval=4118661355 TSecr=845082596"
"56","17.701149130","104.17.24.14","192.168.1.12","TLSv1.3","823","Server Hello, Change Cipher Spec, Application Data, Application Data"
"57","17.701149163","104.17.24.14","192.168.1.12","TLSv1.3","137","Application Data"
"58","17.701216177","192.168.1.12","104.17.24.14","TCP","66","55808  >  443 [ACK] Seq=1262 Ack=758 Win=31872 Len=0 TSval=845082656 TSecr=4118661356"
"59","17.701262195","192.168.1.12","104.17.24.14","TCP","66","55808  >  443 [ACK] Seq=1262 Ack=829 Win=31872 Len=0 TSval=845082656 TSecr=4118661356"
"60","17.702275118","192.168.1.12","104.17.24.14","TLSv1.3","150","Application Data, Application Data"
"61","17.702716192","192.168.1.12","104.17.24.14","TLSv1.3","97","Application Data"
"62","17.795613266","104.17.24.14","192.168.1.12","TCP","66","443  >  55808 [ACK] Seq=829 Ack=1377 Win=73728 Len=0 TSval=4118661413 TSecr=845082657"
"63","17.896731052","146.190.62.39","192.168.1.12","TCP","74","80  >  57902 [SYN, ACK] Seq=0 Ack=1 Win=65160 Len=0 MSS=1412 SACK_PERM TSval=3401210582 TSecr=90926387 WS=128"
"64","17.896769600","192.168.1.12","146.190.62.39","TCP","66","57902  >  80 [ACK] Seq=1 Ack=1 Win=32128 Len=0 TSval=90926621 TSecr=3401210582"
"65","17.897012450","192.168.1.12","146.190.62.39","HTTP","565","GET / HTTP/1.1 "
"66","17.912789748","192.168.1.12","146.190.62.39","TCP","74","57914  >  80 [SYN] Seq=0 Win=32120 Len=0 MSS=1460 SACK_PERM TSval=90926637 TSecr=0 WS=128"
"67","17.917043691","146.190.62.39","192.168.1.12","TCP","74","80  >  57888 [SYN, ACK] Seq=0 Ack=1 Win=65160 Len=0 MSS=1412 SACK_PERM TSval=3401210581 TSecr=90926387 WS=128"
"68","17.917081203","192.168.1.12","146.190.62.39","TCP","66","57888  >  80 [ACK] Seq=1 Ack=1 Win=32128 Len=0 TSval=90926642 TSecr=3401210581"
"69","18.119771498","146.190.62.39","192.168.1.12","TCP","74","80  >  57914 [SYN, ACK] Seq=0 Ack=1 Win=65160 Len=0 MSS=1412 SACK_PERM TSval=3401210814 TSecr=90926637 WS=128"
"70","18.119771632","146.190.62.39","192.168.1.12","TCP","66","80  >  57902 [ACK] Seq=1 Ack=500 Win=64768 Len=0 TSval=3401210814 TSecr=90926622"
"71","18.119771672","146.190.62.39","192.168.1.12","HTTP","815","HTTP/1.1 304 Not Modified "
"72","18.119822310","192.168.1.12","146.190.62.39","TCP","66","57914  >  80 [ACK] Seq=1 Ack=1 Win=32128 Len=0 TSval=90926844 TSecr=3401210814"
"73","18.119844408","192.168.1.12","146.190.62.39","TCP","66","57902  >  80 [ACK] Seq=500 Ack=750 Win=31872 Len=0 TSval=90926844 TSecr=3401210814"
"74","18.160417118","192.168.1.12","8.8.8.8","DNS","106","Standard query 0x14de AAAA cdnjs.cloudflare.com"
"75","18.165807218","192.168.1.12","104.17.24.14","TCP","74","55812  >  443 [SYN] Seq=0 Win=32120 Len=0 MSS=1460 SACK_PERM TSval=845083120 TSecr=0 WS=128"
"76","18.205649326","192.168.1.12","8.8.8.8","DNS","102","Standard query 0x4123 A www.facebook.com"
"77","18.205828975","192.168.1.12","8.8.8.8","DNS","102","Standard query 0x2df0 AAAA www.facebook.com"
"78","18.206091938","192.168.1.12","8.8.8.8","DNS","97","Standard query 0x97c7 A twitter.com"
"79","18.206279738","192.168.1.12","8.8.8.8","DNS","97","Standard query 0x751f AAAA twitter.com"
"80","18.206799403","192.168.1.12","8.8.8.8","DNS","102","Standard query 0x9630 A www.linkedin.com"
"81","18.207025743","192.168.1.12","8.8.8.8","DNS","102","Standard query 0x7f36 AAAA www.linkedin.com"
"82","18.207276013","192.168.1.12","8.8.8.8","DNS","102","Standard query 0x66fa A scotthelme.co.uk"
"83","18.207492231","192.168.1.12","8.8.8.8","DNS","102","Standard query 0x134b AAAA scotthelme.co.uk"
"84","18.207723280","192.168.1.12","8.8.8.8","DNS","96","Standard query 0xd890 A github.com"
"85","18.222074858","104.17.24.14","192.168.1.12","TCP","74","443  >  55812 [SYN, ACK] Seq=0 Ack=1 Win=65535 Len=0 MSS=1400 SACK_PERM TSval=3746786444 TSecr=845083120 WS=8192"
"86","18.222103980","192.168.1.12","104.17.24.14","TCP","66","55812  >  443 [ACK] Seq=1 Ack=1 Win=32128 Len=0 TSval=845083177 TSecr=3746786444"
"87","18.223120962","192.168.1.12","104.17.24.14","TLSv1.3","1229","Client Hello (SNI=cdnjs.cloudflare.com)"
"88","18.223306518","192.168.1.12","104.17.24.14","TLSv1.3","72","Change Cipher Spec"
"89","18.223343166","192.168.1.12","104.17.24.14","TLSv1.3","158","Application Data"
"90","18.264390048","8.8.8.8","192.168.1.12","TCP","78","[TCP Dup ACK 46#1] 53  >  39958 [ACK] Seq=187 Ack=111 Win=268800 Len=0 TSval=75113583 TSecr=3933965084 SLE=187 SRE=223"
"91","18.264390241","8.8.8.8","192.168.1.12","TCP","86","[TCP Dup ACK 46#2] 53  >  39958 [ACK] Seq=187 Ack=111 Win=268800 Len=0 TSval=75113584 TSecr=3933965084 SLE=254 SRE=285 SLE=187 SRE=223"
"92","18.264390310","8.8.8.8","192.168.1.12","TCP","86","53  >  39958 [ACK] Seq=187 Ack=151 Win=268800 Len=0 TSval=75113584 TSecr=3933965584 SLE=254 SRE=285 SLE=187 SRE=223"
"93","18.264390370","8.8.8.8","192.168.1.12","TCP","78","53  >  39958 [ACK] Seq=187 Ack=223 Win=268800 Len=0 TSval=75113584 TSecr=3933965629 SLE=254 SRE=285"
"94","18.264390428","8.8.8.8","192.168.1.12","TCP","66","53  >  39958 [ACK] Seq=187 Ack=285 Win=268800 Len=0 TSval=75113584 TSecr=3933965630"
"95","18.264390481","8.8.8.8","192.168.1.12","TCP","66","53  >  39958 [ACK] Seq=187 Ack=393 Win=268800 Len=0 TSval=75113584 TSecr=3933965630"
"96","18.264390541","8.8.8.8","192.168.1.12","DNS","113","Standard query response 0x97c7 A twitter.com A 104.244.42.129"
"97","18.264390597","8.8.8.8","192.168.1.12","TCP","66","53  >  39958 [ACK] Seq=234 Ack=459 Win=268800 Len=0 TSval=75113584 TSecr=3933965631"
"98","18.264426520","192.168.1.12","8.8.8.8","TCP","142","[TCP Spurious Retransmission] 39958  >  53 [PSH, ACK] Seq=111 Ack=187 Win=32128 Len=76 TSval=3933965688 TSecr=75113583"
"99","18.264469365","192.168.1.12","8.8.8.8","DNS","456","Standard query 0x4ef5 AAAA github.com, Standard query 0xc16d A www.youtube.com, Standard query 0xf3ed AAAA www.youtube.com, Standard query 0xc0a2 A creativecommons.org, Standard query 0x8337 AAAA creativecommons.org, Standard query 0xca92 A report-uri.com, Standard query 0x636d AAAA report-uri.com, Standard query 0x5252 A securityheaders.com, Standard query 0xc253 AAAA securityheaders.com, Standard query 0x6c72 A crawler.ninja, Standard query 0xefc2 AAAA crawler.ninja"
"100","18.264563255","8.8.8.8","192.168.1.12","DNS","162","Standard query response 0x751f AAAA twitter.com SOA a.u06.twtrdns.net"
"101","18.264563310","8.8.8.8","192.168.1.12","DNS","205","Standard query response 0x9630 A www.linkedin.com CNAME afd-lnkd.www.linkedin.com CNAME www-linkedin-com.l-0005.l-msedge.net CNAME l-0005.l-msedge.net A 13.107.42.14"
"102","18.264563373","8.8.8.8","192.168.1.12","DNS","147","Standard query response 0x4123 A www.facebook.com CNAME star-mini.c10r.facebook.com A 157.240.212.35"
"103","18.264563417","8.8.8.8","192.168.1.12","DNS","159","Standard query response 0x2df0 AAAA www.facebook.com CNAME star-mini.c10r.facebook.com AAAA 2a03:2880:f152:82:face:b00c:0:25de"
"104","18.264563463","8.8.8.8","192.168.1.12","DNS","112","Standard query response 0xd890 A github.com A 140.82.121.4"
"105","18.264563506","8.8.8.8","192.168.1.12","DNS","162","Standard query response 0x14de AAAA cdnjs.cloudflare.com AAAA 2606:4700::6811:190e AAAA 2606:4700::6811:180e"
"106","18.264563551","8.8.8.8","192.168.1.12","DNS","186","Standard query response 0x134b AAAA scotthelme.co.uk AAAA 2606:4700:20::681a:202 AAAA 2606:4700:20::ac43:4580 AAAA 2606:4700:20::681a:302"
"107","18.266124887","192.168.1.12","8.8.8.8","TCP","66","39958  >  53 [ACK] Seq=849 Ack=905 Win=31872 Len=0 TSval=3933965690 TSecr=75113584"
"108","18.274541579","8.8.8.8","192.168.1.12","DNS","150","Standard query response 0x66fa A scotthelme.co.uk A 172.67.69.128 A 104.26.3.2 A 104.26.2.2"
"109","18.295475388","104.17.24.14","192.168.1.12","TCP","66","443  >  55812 [ACK] Seq=1 Ack=1164 Win=73728 Len=0 TSval=3746786505 TSecr=845083178"
"110","18.295475742","104.17.24.14","192.168.1.12","TCP","66","443  >  55812 [ACK] Seq=1 Ack=1170 Win=73728 Len=0 TSval=3746786505 TSecr=845083178"
"111","18.295475808","104.17.24.14","192.168.1.12","TCP","66","443  >  55812 [ACK] Seq=1 Ack=1262 Win=73728 Len=0 TSval=3746786506 TSecr=845083178"
"112","18.295475855","104.17.24.14","192.168.1.12","TLSv1.3","823","Server Hello, Change Cipher Spec, Application Data, Application Data"
"113","18.295475902","104.17.24.14","192.168.1.12","TLSv1.3","137","Application Data"
"114","18.295524859","192.168.1.12","104.17.24.14","TCP","66","55812  >  443 [ACK] Seq=1262 Ack=758 Win=31872 Len=0 TSval=845083250 TSecr=3746786506"
"115","18.295545989","192.168.1.12","104.17.24.14","TCP","66","55812  >  443 [ACK] Seq=1262 Ack=829 Win=31872 Len=0 TSval=845083250 TSecr=3746786506"
"116","18.296301525","192.168.1.12","104.17.24.14","TLSv1.3","150","Application Data, Application Data"
"117","18.297114009","192.168.1.12","104.17.24.14","TLSv1.3","97","Application Data"
"118","18.315454731","8.8.8.8","192.168.1.12","DNS","228","Standard query response 0x7f36 AAAA www.linkedin.com CNAME cf-afd.www.linkedin.com CNAME www.linkedin.com.cdn.cloudflare.net AAAA 2606:4700:4400::6812:2929 AAAA 2606:4700:4400::ac40:92d7"
"119","18.315481138","192.168.1.12","8.8.8.8","TCP","66","39958  >  53 [ACK] Seq=849 Ack=1151 Win=31872 Len=0 TSval=3933965739 TSecr=75113601"
"120","18.325826034","8.8.8.8","192.168.1.12","TCP","78","[TCP Dup ACK 97#1] 53  >  39958 [ACK] Seq=1151 Ack=459 Win=268800 Len=0 TSval=75113647 TSecr=3933965631 SLE=111 SRE=187"
"121","18.325826238","8.8.8.8","192.168.1.12","TCP","66","53  >  39958 [ACK] Seq=1151 Ack=849 Win=268544 Len=0 TSval=75113647 TSecr=3933965688"
"122","18.325826297","8.8.8.8","192.168.1.12","DNS","180","Standard query response 0x4ef5 AAAA github.com SOA ns-1707.awsdns-21.co.uk"
"123","18.325826339","8.8.8.8","192.168.1.12","DNS","359","Standard query response 0xc16d A www.youtube.com CNAME youtube-ui.l.google.com A 216.58.211.206 A 142.250.203.238 A 142.250.200.238 A 142.251.37.238 A 142.250.200.206 A 172.217.19.142 A 172.217.18.46 A 142.250.201.14 A 172.217.21.14 A 142.251.37.206 A 142.251.37.46 A 142.250.201.46 A 172.217.171.206 A 142.251.37.174"
"124","18.325826389","8.8.8.8","192.168.1.12","DNS","189","Standard query response 0x8337 AAAA creativecommons.org AAAA 2606:4700:10::ac43:1bf AAAA 2606:4700:10::6814:686 AAAA 2606:4700:10::6814:586"
"125","18.325826430","8.8.8.8","192.168.1.12","DNS","153","Standard query response 0xc0a2 A creativecommons.org A 172.67.1.191 A 104.20.6.134 A 104.20.5.134"
"126","18.325826479","8.8.8.8","192.168.1.12","DNS","132","Standard query response 0xca92 A report-uri.com A 104.17.214.66 A 104.17.215.66"
"127","18.325826528","8.8.8.8","192.168.1.12","DNS","189","Standard query response 0xc253 AAAA securityheaders.com AAAA 2606:4700:20::681a:c39 AAAA 2606:4700:20::681a:d39 AAAA 2606:4700:20::ac43:48b1"
"128","18.325881153","192.168.1.12","8.8.8.8","TCP","66","39958  >  53 [ACK] Seq=849 Ack=1768 Win=31872 Len=0 TSval=3933965749 TSecr=75113647"
"129","18.325949520","8.8.8.8","192.168.1.12","DNS","156","Standard query response 0x636d AAAA report-uri.com AAAA 2606:4700::6811:d742 AAAA 2606:4700::6811:d642"
"130","18.325949559","8.8.8.8","192.168.1.12","DNS","153","Standard query response 0x5252 A securityheaders.com A 172.67.72.177 A 104.26.13.57 A 104.26.12.57"
"131","18.327564273","192.168.1.12","8.8.8.8","TCP","66","39958  >  53 [ACK] Seq=849 Ack=2134 Win=31872 Len=0 TSval=3933965751 TSecr=75113650"
"132","18.346750763","8.8.8.8","192.168.1.12","DNS","247","Standard query response 0xf3ed AAAA www.youtube.com CNAME youtube-ui.l.google.com AAAA 2a00:1450:4006:80c::200e AAAA 2a00:1450:4006:801::200e AAAA 2a00:1450:4006:80d::200e AAAA 2a00:1450:4006:80e::200e"
"133","18.346750918","8.8.8.8","192.168.1.12","DNS","131","Standard query response 0x6c72 A crawler.ninja A 188.114.97.5 A 188.114.96.5"
"134","18.346750958","8.8.8.8","192.168.1.12","DNS","155","Standard query response 0xefc2 AAAA crawler.ninja AAAA 2a06:98c1:3121::5 AAAA 2a06:98c1:3120::5"
"135","18.347708204","192.168.1.12","8.8.8.8","TCP","66","39958  >  53 [ACK] Seq=849 Ack=2469 Win=31872 Len=0 TSval=3933965771 TSecr=75113668"
"136","18.367170818","104.17.24.14","192.168.1.12","TCP","66","443  >  55812 [ACK] Seq=829 Ack=1377 Win=73728 Len=0 TSval=3746786587 TSecr=845083251"
"142","20.373763564","8.8.8.8","192.168.1.12","TCP","66","53  >  39958 [FIN, ACK] Seq=2469 Ack=849 Win=268800 Len=0 TSval=75115647 TSecr=3933965771"
"143","20.373856909","192.168.1.12","8.8.8.8","TCP","66","39958  >  53 [FIN, ACK] Seq=849 Ack=2470 Win=31872 Len=0 TSval=3933967797 TSecr=75115647"
"144","20.476694726","8.8.8.8","192.168.1.12","TCP","66","53  >  39958 [ACK] Seq=2470 Ack=850 Win=268800 Len=0 TSval=75115754 TSecr=3933967797"
"153","23.703393608","192.168.1.12","146.190.62.39","TCP","66","57914  >  80 [FIN, ACK] Seq=1 Ack=1 Win=32128 Len=0 TSval=90932428 TSecr=3401210814"
"154","23.703458036","192.168.1.12","146.190.62.39","TCP","66","57888  >  80 [FIN, ACK] Seq=1 Ack=1 Win=32128 Len=0 TSval=90932428 TSecr=3401210581"
"155","23.921903666","146.190.62.39","192.168.1.12","TCP","66","80  >  57914 [FIN, ACK] Seq=1 Ack=2 Win=65280 Len=0 TSval=3401216610 TSecr=90932428"
"156","23.921925913","192.168.1.12","146.190.62.39","TCP","66","57914  >  80 [ACK] Seq=2 Ack=2 Win=32128 Len=0 TSval=90932646 TSecr=3401216610"
"157","23.932039871","146.190.62.39","192.168.1.12","TCP","66","80  >  57888 [FIN, ACK] Seq=1 Ack=2 Win=65280 Len=0 TSval=3401216610 TSecr=90932428"
"158","23.932065140","192.168.1.12","146.190.62.39","TCP","66","57888  >  80 [ACK] Seq=2 Ack=2 Win=32128 Len=0 TSval=90932657 TSecr=3401216610"
"167","28.319016634","192.168.1.12","146.190.62.39","TCP","66","[TCP Keep-Alive] 57902  >  80 [ACK] Seq=499 Ack=750 Win=31872 Len=0 TSval=90937044 TSecr=3401210814"
"168","28.564245424","146.190.62.39","192.168.1.12","TCP","66","[TCP Keep-Alive ACK] 80  >  57902 [ACK] Seq=750 Ack=500 Win=64768 Len=0 TSval=3401221252 TSecr=90926844"
"191","39.071017061","192.168.1.12","146.190.62.39","TCP","66","[TCP Keep-Alive] 57902  >  80 [ACK] Seq=499 Ack=750 Win=31872 Len=0 TSval=90947796 TSecr=3401221252"
"192","39.282576515","146.190.62.39","192.168.1.12","TCP","66","[TCP Keep-Alive ACK] 80  >  57902 [ACK] Seq=750 Ack=500 Win=64768 Len=0 TSval=3401231975 TSecr=90926844"
"213","49.311036792","192.168.1.12","146.190.62.39","TCP","66","[TCP Keep-Alive] 57902  >  80 [ACK] Seq=499 Ack=750 Win=31872 Len=0 TSval=90958036 TSecr=3401231975"
"214","49.562432467","146.190.62.39","192.168.1.12","TCP","66","[TCP Keep-Alive ACK] 80  >  57902 [ACK] Seq=750 Ack=500 Win=64768 Len=0 TSval=3401242251 TSecr=90926844"
"237","60.063018303","192.168.1.12","146.190.62.39","TCP","66","[TCP Keep-Alive] 57902  >  80 [ACK] Seq=499 Ack=750 Win=31872 Len=0 TSval=90968788 TSecr=3401242251"
"238","60.279572690","146.190.62.39","192.168.1.12","TCP","66","[TCP Keep-Alive ACK] 80  >  57902 [ACK] Seq=750 Ack=500 Win=64768 Len=0 TSval=3401252964 TSecr=90926844"
"259","70.303044717","192.168.1.12","146.190.62.39","TCP","66","[TCP Keep-Alive] 57902  >  80 [ACK] Seq=499 Ack=750 Win=31872 Len=0 TSval=90979028 TSecr=3401252964"
"260","70.534714513","146.190.62.39","192.168.1.12","TCP","66","[TCP Keep-Alive ACK] 80  >  57902 [ACK] Seq=750 Ack=500 Win=64768 Len=0 TSval=3401263220 TSecr=90926844"
"275","76.663693485","192.168.1.12","104.17.24.14","TLSv1.3","105","Application Data"
"276","76.663763213","192.168.1.12","104.17.24.14","TLSv1.3","105","Application Data"
"277","76.712276812","104.17.24.14","192.168.1.12","TLSv1.3","105","Application Data"
"278","76.722399327","104.17.24.14","192.168.1.12","TLSv1.3","105","Application Data"
"280","76.753218997","192.168.1.12","104.17.24.14","TCP","66","55808  >  443 [ACK] Seq=1416 Ack=868 Win=31872 Len=0 TSval=845141708 TSecr=4118720371"
"281","76.763335918","192.168.1.12","104.17.24.14","TCP","66","55812  >  443 [ACK] Seq=1416 Ack=868 Win=31872 Len=0 TSval=845141718 TSecr=3746844947"
"290","80.543018280","192.168.1.12","146.190.62.39","TCP","66","[TCP Keep-Alive] 57902  >  80 [ACK] Seq=499 Ack=750 Win=31872 Len=0 TSval=90989268 TSecr=3401263220"
"292","80.760126911","146.190.62.39","192.168.1.12","TCP","66","[TCP Keep-Alive ACK] 80  >  57902 [ACK] Seq=750 Ack=500 Win=64768 Len=0 TSval=3401273445 TSecr=90926844"
"313","90.783029278","192.168.1.12","146.190.62.39","TCP","66","[TCP Keep-Alive] 57902  >  80 [ACK] Seq=499 Ack=750 Win=31872 Len=0 TSval=90999508 TSecr=3401273445"
"315","91.020265827","146.190.62.39","192.168.1.12","TCP","66","[TCP Keep-Alive ACK] 80  >  57902 [ACK] Seq=750 Ack=500 Win=64768 Len=0 TSval=3401283714 TSecr=90926844"
"320","93.177721572","146.190.62.39","192.168.1.12","TCP","66","80  >  57902 [FIN, ACK] Seq=750 Ack=500 Win=64768 Len=0 TSval=3401285815 TSecr=90926844"
"321","93.177821430","192.168.1.12","146.190.62.39","TCP","66","57902  >  80 [FIN, ACK] Seq=500 Ack=751 Win=31872 Len=0 TSval=91001902 TSecr=3401285815"
"324","93.855187762","192.168.1.12","146.190.62.39","TCP","66","[TCP Retransmission] 57902  >  80 [FIN, ACK] Seq=500 Ack=751 Win=31872 Len=0 TSval=91002580 TSecr=3401285815"
"325","94.559048635","192.168.1.12","146.190.62.39","TCP","66","[TCP Retransmission] 57902  >  80 [FIN, ACK] Seq=500 Ack=751 Win=31872 Len=0 TSval=91003284 TSecr=3401285815"
"330","95.967563625","192.168.1.12","146.190.62.39","TCP","66","[TCP Retransmission] 57902  >  80 [FIN, ACK] Seq=500 Ack=751 Win=31872 Len=0 TSval=91004692 TSecr=3401285815"
"335","98.784898652","192.168.1.12","146.190.62.39","TCP","66","[TCP Retransmission] 57902  >  80 [FIN, ACK] Seq=500 Ack=751 Win=31872 Len=0 TSval=91007509 TSecr=3401285815"
"348","104.608150137","192.168.1.12","146.190.62.39","TCP","66","[TCP Retransmission] 57902  >  80 [FIN, ACK] Seq=500 Ack=751 Win=31872 Len=0 TSval=91013333 TSecr=3401285815"
"365","112.435329660","192.168.1.12","146.190.62.39","TCP","74","47974  >  80 [SYN] Seq=0 Win=32120 Len=0 MSS=1460 SACK_PERM TSval=91021160 TSecr=0 WS=128"
"366","112.443270952","192.168.1.12","146.190.62.39","TCP","74","47976  >  80 [SYN] Seq=0 Win=32120 Len=0 MSS=1460 SACK_PERM TSval=91021168 TSecr=0 WS=128"
"367","112.652102078","146.190.62.39","192.168.1.12","TCP","74","80  >  47974 [SYN, ACK] Seq=0 Ack=1 Win=65160 Len=0 MSS=1412 SACK_PERM TSval=3401305331 TSecr=91021160 WS=128"
"368","112.652155941","192.168.1.12","146.190.62.39","TCP","66","47974  >  80 [ACK] Seq=1 Ack=1 Win=32128 Len=0 TSval=91021377 TSecr=3401305331"
"369","112.652430418","192.168.1.12","146.190.62.39","HTTP","565","GET / HTTP/1.1 "
"370","112.672410067","146.190.62.39","192.168.1.12","TCP","74","80  >  47976 [SYN, ACK] Seq=0 Ack=1 Win=65160 Len=0 MSS=1412 SACK_PERM TSval=3401305341 TSecr=91021168 WS=128"
"371","112.672496503","192.168.1.12","146.190.62.39","TCP","66","47976  >  80 [ACK] Seq=1 Ack=1 Win=32128 Len=0 TSval=91021397 TSecr=3401305341"
"373","112.875768205","146.190.62.39","192.168.1.12","TCP","66","80  >  47974 [ACK] Seq=1 Ack=500 Win=64768 Len=0 TSval=3401305556 TSecr=91021377"
"374","112.875768359","146.190.62.39","192.168.1.12","HTTP","815","HTTP/1.1 304 Not Modified "
"375","112.875823095","192.168.1.12","146.190.62.39","TCP","66","47974  >  80 [ACK] Seq=500 Ack=750 Win=31872 Len=0 TSval=91021600 TSecr=3401305556"
"377","112.943700177","192.168.1.12","8.8.8.8","DNS","117","Standard query 0x475e AAAA twitter.com"
"378","112.998386069","8.8.8.8","192.168.1.12","TCP","74","53  >  46144 [SYN, ACK] Seq=0 Ack=32 Win=65535 Len=0 MSS=1412 SACK_PERM TSval=3484910969 TSecr=3934060367 WS=256"
"379","112.998386166","8.8.8.8","192.168.1.12","DNS","162","Standard query response 0x475e AAAA twitter.com SOA a.u06.twtrdns.net"
"380","112.998435048","192.168.1.12","8.8.8.8","TCP","66","46144  >  53 [ACK] Seq=32 Ack=1 Win=32128 Len=0 TSval=3934060422 TSecr=3484910969"
"381","112.998451634","192.168.1.12","8.8.8.8","TCP","66","46144  >  53 [ACK] Seq=32 Ack=97 Win=32128 Len=0 TSval=3934060422 TSecr=3484910969"
"382","112.998504658","192.168.1.12","8.8.8.8","DNS","102","Standard query 0x9f46 A www.facebook.com"
"383","112.998781182","192.168.1.12","8.8.8.8","DNS","102","Standard query 0x183c AAAA www.facebook.com"
"384","112.998851975","192.168.1.12","8.8.8.8","DNS","138","Standard query 0x63f0 A www.linkedin.com, Standard query 0x5289 AAAA www.linkedin.com"
"385","112.998931199","192.168.1.12","8.8.8.8","DNS","196","Standard query 0x8ef4 A github.com, Standard query 0x6cbc AAAA github.com, Standard query 0x8f6c A www.youtube.com, Standard query 0x4089 AAAA www.youtube.com"
"386","113.059305818","8.8.8.8","192.168.1.12","TCP","66","53  >  46144 [ACK] Seq=97 Ack=68 Win=268800 Len=0 TSval=3484911027 TSecr=3934060422"
"387","113.059306040","8.8.8.8","192.168.1.12","TCP","78","[TCP Dup ACK 386#1] 53  >  46144 [ACK] Seq=97 Ack=68 Win=268800 Len=0 TSval=3484911028 TSecr=3934060422 SLE=176 SRE=306"
"388","113.059306099","8.8.8.8","192.168.1.12","DNS","159","Standard query response 0x9f46 A www.facebook.com CNAME star-mini.c10r.facebook.com A 157.240.212.35"
"389","113.078149182","192.168.1.12","8.8.8.8","TCP","174","[TCP Retransmission] 46144  >  53 [PSH, ACK] Seq=68 Ack=178 Win=32128 Len=108 TSval=3934060502 TSecr=3484911029"
"390","113.131757421","8.8.8.8","192.168.1.12","TCP","66","53  >  46144 [ACK] Seq=178 Ack=306 Win=268800 Len=0 TSval=3484911102 TSecr=3934060502"
"391","113.131757624","8.8.8.8","192.168.1.12","DNS","180","Standard query response 0x6cbc AAAA github.com SOA ns-1707.awsdns-21.co.uk"
"392","113.131757654","8.8.8.8","192.168.1.12","DNS","375","Standard query response 0x8f6c A www.youtube.com CNAME youtube-ui.l.google.com A 142.250.201.46 A 142.250.201.14 A 142.250.203.238 A 172.217.171.206 A 172.217.21.14 A 142.251.37.206 A 142.251.37.238 A 216.58.211.206 A 172.217.18.238 A 142.250.200.206 A 216.58.205.206 A 142.251.37.46 A 172.217.19.142 A 142.251.37.174 A 142.250.200.238"
"393","113.131757685","8.8.8.8","192.168.1.12","DNS","112","Standard query response 0x8ef4 A github.com A 140.82.121.3"
"394","113.131757714","8.8.8.8","192.168.1.12","DNS","159","Standard query response 0x183c AAAA www.facebook.com CNAME star-mini.c10r.facebook.com AAAA 2a03:2880:f152:82:face:b00c:0:25de"
"395","113.131824222","192.168.1.12","8.8.8.8","TCP","66","46144  >  53 [ACK] Seq=306 Ack=740 Win=31872 Len=0 TSval=3934060555 TSecr=3484911102"
"396","113.152040060","8.8.8.8","192.168.1.12","DNS","204","Standard query response 0x63f0 A www.linkedin.com CNAME cf-afd.www.linkedin.com CNAME www.linkedin.com.cdn.cloudflare.net A 104.18.41.41 A 172.64.146.215"
"397","113.152040240","8.8.8.8","192.168.1.12","DNS","247","Standard query response 0x4089 AAAA www.youtube.com CNAME youtube-ui.l.google.com AAAA 2a00:1450:4006:80d::200e AAAA 2a00:1450:4006:801::200e AAAA 2a00:1450:4006:80c::200e AAAA 2a00:1450:4006:80e::200e"
"398","113.152537179","192.168.1.12","8.8.8.8","TCP","66","46144  >  53 [ACK] Seq=306 Ack=1059 Win=31872 Len=0 TSval=3934060576 TSecr=3484911122"
"399","113.163407818","8.8.8.8","192.168.1.12","DNS","228","Standard query response 0x5289 AAAA www.linkedin.com CNAME cf-afd.www.linkedin.com CNAME www.linkedin.com.cdn.cloudflare.net AAAA 2606:4700:4400::ac40:92d7 AAAA 2606:4700:4400::6812:2929"
"400","113.204355734","192.168.1.12","8.8.8.8","TCP","66","46144  >  53 [ACK] Seq=306 Ack=1221 Win=31872 Len=0 TSval=3934060628 TSecr=3484911133"
"405","115.136908061","8.8.8.8","192.168.1.12","TCP","66","53  >  46144 [FIN, ACK] Seq=1221 Ack=306 Win=268800 Len=0 TSval=3484913102 TSecr=3934060628"
"406","115.136989600","192.168.1.12","8.8.8.8","TCP","66","46144  >  53 [FIN, ACK] Seq=306 Ack=1222 Win=31872 Len=0 TSval=3934062560 TSecr=3484913102"
"407","115.197425131","8.8.8.8","192.168.1.12","TCP","66","53  >  46144 [ACK] Seq=1222 Ack=307 Win=268800 Len=0 TSval=3484913165 TSecr=3934062560"
"409","115.871868991","192.168.1.12","146.190.62.39","TCP","66","[TCP Retransmission] 57902  >  80 [FIN, ACK] Seq=500 Ack=751 Win=31872 Len=0 TSval=91024596 TSecr=3401285815"
"415","118.653424526","192.168.1.12","146.190.62.39","TCP","66","47976  >  80 [FIN, ACK] Seq=1 Ack=1 Win=32128 Len=0 TSval=91027378 TSecr=3401305341"
